{
  "schema": 1,
  "note": "What the HUD says about reads and about the guided first match (docs/ui/hud-spec.md sections 18 and 19). finisher_counter: the stance that answers each finisher kind (Game Design, spec-wounds.md section 1: GUARD a launch, DODGE a melee, PRESS a beam with 40 Charge); the telegraph chip shows it only while prompts are on. beat_ids: the tutorial's nine beats in order (the dots under a hint). hints: Narrative's lines (docs/narrative/tutorial-hints.md), keyed beat.variant; a tutorial_hint event names its key and the HUD looks the words up here. Lines are plain text, at most about ten words.",
  "finisher_counter": { "launch": "guard", "melee": "dodge", "beam": "press" },
  "beat_ids": ["b1", "b2", "b3", "b4", "b5", "b6", "b7", "b8", "b9"],
  "hints": {
    "b1.hint": "Fly. The world wraps: keep going and you come back round.",
    "b1.alt0": "Head for your rival, or keep going and watch the world wrap.",
    "b1.nudge": "Try flying the other way. It's the same planet.",
    "b1.done": "See? No edges.",
    "b2.hint": "Your stance is your intent. The fight follows it.",
    "b2.alt0": "Change stance and watch how the fight changes.",
    "b2.alt1": "Try a different stance. See what the fight does.",
    "b2.nudge": "Pick another stance. The fight will follow.",
    "b2.done": "Different stance, different fight.",
    "b3.hint": "They're guarding. Hit heavy.",
    "b3.alt0": "A guarding rival breaks under heavy blows.",
    "b3.alt1": "Guard up? Go heavy.",
    "b3.nudge": "Set your attack to heavy while they guard.",
    "b3.done": "Guard broken. That's the read.",
    "b4.hint": "Watch the body: that's how you read damage.",
    "b4.alt0": "No health bar. Look at their arms, legs and head.",
    "b4.alt1": "Where is the rival hurt? Look.",
    "b4.nudge": "Look at the rival. Where are they worn?",
    "b4.done": "Now you can read a wound.",
    "b5.hint": "Big swing coming. Slip it.",
    "b5.alt0": "A heavy is winding up. DODGE, or GUARD and wait.",
    "b5.alt1": "See the wind-up? Answer it with a stance.",
    "b5.nudge": "When they wind up big, choose DODGE or GUARD.",
    "b5.done": "You read it and answered it. That's the game.",
    "b6.hint": "Charge, then call your signature.",
    "b6.alt0": "Hold Charge until it's full enough, then set your signature.",
    "b6.nudge": "Charge up. Your signature needs a full 45.",
    "b6.done": "Signature away. Watch it land.",
    "b7.hint": "You're ready. Transform when you choose.",
    "b7.alt0": "The change is ready. Take it whenever you like.",
    "b7.nudge": "Your transformation is ready. Nobody will stop you.",
    "b7.done": "Nobody interrupts a transformation. Take your time.",
    "b8.hint": "They're going for the finish. Brace, slip or meet it.",
    "b8.alt0": "A finisher is coming. Pick the stance that answers it.",
    "b8.alt1": "Their finish has a kind. Match it.",
    "b8.nudge": "Choose a stance to match their finisher.",
    "b8.done": "You held. The fight is still yours.",
    "b9.hint": "From here, the fight is yours.",
    "b9.alt0": "You have the reads. Go and win.",
    "b9.alt1": "That's everything. It's your fight now.",
    "b9.done": "Good. Now go and play."
  }
}
